{
  "name": "rvdbreemen-adr-kit",
  "description": "Marketplace hosting the adr-kit plugin: a drop-in Architecture Decision Record toolkit for AI coding agents.",
  "owner": {
    "name": "Robert van den Breemen",
    "url": "https://github.com/rvdbreemen"
  },
  "plugins": [
    {
      "name": "adr-kit",
      "source": "./",
      "version": "0.61.0",
      "description": "Drop-in ADR toolkit for AI coding agents: bootstrap and audit with /adr-kit:init, guided authoring with /adr-kit:adr, pre-commit and CI enforcement with file:line citations, context injection over a generated graph index, Guardian staleness detection, lifecycle commands, strict lint, adr-doctor, and a key-free MCP server.",
      "homepage": "https://github.com/rvdbreemen/adr-kit",
      "license": "MIT"
    }
  ]
}
